{
  "$schema": "http://json-schema.org/draft/2019-09/schema",
  "title": "LLC_CapitalIncrease",
  "type": "object",
  "properties": {
    "company": {
      "type": "object",
      "properties": {
        "shareholders": {
          "type": "array",
          "items": {
            "$ref": "#/$defs/shareholder"
          }
        },
        "directors": {
          "type": "array",
          "items": {
            "$ref": "#/$defs/director"
          }
        }
      },
      "required": [
        "shareholders",
        "directors"
      ],
      "additionalProperties": false
    },
    "capital_increase_resolution": {
      "type": "object",
      "properties": {
        "meeting": {
          "$ref": "#/$defs/meeting"
        },
        "voting": {
          "$ref": "#/$defs/voting"
        },
        "written_consents": {
          "$ref": "#/$defs/shareholders_references"
        },
        "consents_to_voting_in_writing": {
          "$ref": "#/$defs/shareholders_references"
        },
        "notarized": {
          "type": "boolean"
        }
      },
      "required": [
        "meeting",
        "notarized"
      ],
      "additionalProperties": false
    },
    "permit_resolution": {
      "type": "object",
      "properties": {
        "admitted_shareholders": {
          "$ref": "#/$defs/shareholders_references"
        },
        "meeting": {
          "$ref": "#/$defs/meeting"
        },
        "voting": {
          "$ref": "#/$defs/voting"
        },
        "written_consents": {
          "$ref": "#/$defs/shareholders_references"
        },
        "consents_to_voting_in_writing": {
          "$ref": "#/$defs/shareholders_references"
        }
      },
      "required": [
        "admitted_shareholders",
        "meeting"
      ],
      "additionalProperties": false
    },
    "application": {
      "type": "object",
      "properties": {
        "contains_AoA_full_text": {
          "type": "boolean"
        },
        "amended_AoA": {
          "$ref": "#/$defs/amended_AoA"
        },
        "has_increased_capital_been_covered": {
          "type": "boolean"
        },
        "assurance_signed": {
          "type": "boolean"
        },
        "subscriber_list": {
          "type": "array",
          "items": {
            "$ref": "#/$defs/subscription"
          }
        },
        "declarations": {
          "type": "array",
          "items": {
            "$ref": "#/$defs/declaration"
          }
        },
        "applicants": {
          "$ref": "#/$defs/directors_references"
        }
      },
      "required": [
        "contains_AoA_full_text",
        "amended_AoA",
        "has_increased_capital_been_covered",
        "assurance_signed",
        "subscriber_list",
        "declarations",
        "applicants"
      ],
      "additionalProperties": false
    }
  },
  "required": [
    "company",
    "capital_increase_resolution",
    "application"
  ],
  "additionalProperties": false,
  "$defs": {
    "shareholder": {
      "type": "object",
      "properties": {
        "name": {
          "type": "string"
        },
        "votes": {
          "type": "integer"
        }
      },
      "required": [
        "name",
        "votes"
      ],
      "additionalProperties": false
    },
    "director": {
      "type": "object",
      "properties": {
        "name": {
          "type": "string"
        }
      },
      "required": [
        "name"
      ],
      "additionalProperties": false
    },
    "subscription": {
      "type": "object",
      "properties": {
        "name": {
          "type": "string"
        },
        "shares": {
          "type": "integer"
        }
      },
      "required": [
        "name",
        "shares"
      ],
      "additionalProperties": false
    },
    "declaration": {
      "type": "object",
      "properties": {
        "signer": {
          "type": "string"
        },
        "format": {
          "$ref": "#/$defs/declaration_format"
        },
        "notarized": {
          "type": "boolean"
        }
      },
      "required": [
        "signer",
        "format"
      ],
      "additionalProperties": false
    },
    "meeting": {
      "type": "object",
      "properties": {
        "occurred": {
          "type": "boolean"
        },
        "format": {
          "$ref": "#/$defs/meeting_format"
        },
        "consents_to_teleconference": {
          "$ref": "#/$defs/shareholders_references"
        }
      },
      "required": [
        "occurred"
      ],
      "additionalProperties": false
    },
    "voting": {
      "type": "object",
      "properties": {
        "yes_votes": {
          "type": "integer"
        },
        "no_votes": {
          "type": "integer"
        },
        "abstentions": {
          "type": "integer"
        }
      },
      "required": [],
      "additionalProperties": false
    },
    "amended_AoA": {
      "type": "object",
      "properties": {
        "matches_notarily_certified": {
          "type": "boolean"
        },
        "former_capital": {
          "type": "integer"
        },
        "increase": {
          "type": "integer"
        },
        "new_capital": {
          "type": "integer"
        }
      },
      "required": [
        "matches_notarily_certified",
        "former_capital",
        "increase",
        "new_capital"
      ],
      "additionalProperties": false
    },
    "meeting_format": {
      "type": [
        "string",
        "null"
      ],
      "enum": [
        null,
        "",
        "personal",
        "teleconference"
      ]
    },
    "declaration_format": {
      "type": "string",
      "enum": [
        "original",
        "certifiedcopy"
      ]
    },
    "shareholders_references": {
      "type": [
        "array",
        "null"
      ],
      "items": {
        "type": "string"
      }
    },
    "directors_references": {
      "type": [
        "array",
        "null"
      ],
      "items": {
        "type": "string"
      }
    },
    "between_zero_and_one": {
      "type": "number",
      "minimum": 0,
      "maximum": 1
    }
  }
}